{
  "$schema": "https://json-schema.org/draft/2020-12/schema",
  "$id": "https://design-governance.invalid/v1/domain-frame.schema.json",
  "title": "Design Governance V1 — DOMAIN_FRAME",
  "type": "object",
  "required": ["domain", "audience", "expertise", "jtbd", "trust_model", "critical_actions", "domain_conventions", "cultural_context", "originality_tolerance", "proof_requirements", "domain_risks", "required_research", "critical_states", "design_constraints", "evidence_plan", "policy_profile"],
  "additionalProperties": false,
  "properties": {
    "domain": {"type":"string","minLength":1}, "audience":{"type":"string","minLength":1}, "expertise":{"type":"string","minLength":1}, "jtbd":{"type":"string","minLength":1}, "trust_model":{"type":"string","minLength":1},
    "critical_actions":{"type":"array","minItems":1,"items":{"type":"string","minLength":1}}, "domain_conventions":{"type":"array","minItems":1,"items":{"type":"string","minLength":1}}, "cultural_context":{"type":"string","minLength":1}, "originality_tolerance":{"enum":["low","medium","high","unknown"]}, "proof_requirements":{"type":"array","minItems":1,"items":{"type":"string","minLength":1}},
    "domain_risks":{"type":"array","minItems":1,"items":{"type":"string","minLength":1}}, "required_research":{"type":"array","minItems":1,"items":{"type":"string","minLength":1}}, "critical_states":{"type":"array","minItems":1,"items":{"type":"string","minLength":1}}, "design_constraints":{"type":"array","minItems":1,"items":{"type":"string","minLength":1}}, "evidence_plan":{"type":"array","minItems":1,"items":{"type":"string","minLength":1}},
    "policy_profile":{"type":"object","required":["risk_triggers","required_controls","depth_rules","contraindications"],"additionalProperties":false,"properties":{"risk_triggers":{"type":"array","minItems":1,"items":{"type":"string","minLength":1}},"required_controls":{"type":"array","minItems":1,"items":{"type":"string","minLength":1}},"depth_rules":{"type":"array","minItems":1,"items":{"type":"string","minLength":1}},"contraindications":{"type":"array","minItems":1,"items":{"type":"string","minLength":1}}}}
  }
}

